step,object,x,y,zoom,question,answer,layer1_button,layer1_content,layer2_button,layer2_content
#,object_id from the objects tab,horizontal position 0-1 (0.5 = center),vertical position 0-1 (0.5 = center),(1.0 = full image),Heading for this step,Brief 1-2 sentence text,"Optional button text (default: ""Learn more"")","Panel content: write text here, paste markdown, or enter path to .md file (e.g. your-story/file.md)","Optional second button text (default: ""Go deeper"")","Second panel: write text here, paste markdown, or enter path to .md file"
1,demo-bogota-1614,0.5,0.5,1,Why was this map drawn?,"The Painting of the lands, marshes, and swamps of the town of Bogotá was presented as evidence during a 1614 legal proceeding brought by the crown prosecutor of the New Kingdom of Granada against Francisco Maldonado y Mendoza, a renowned encomendero, over the ownership of lands in the Bogotá savanna.",The Legal Proceeding,colonial-landscapes/legal_proceeding.md,The Encomendero,colonial-landscapes/encomendero_biography.md
2,demo-bogota-1614,0.25,0.35,2.5,What does the map show?,"The map features the Bogotá savanna, a high plateau on the eastern mountain range of the northern Andes. In the early sixteenth century, the savanna was occupied by the Indigenous Muisca people. A Spanish expedition led by Gonzalo Jiménez de Quesada arrived there in 1536, and the city became the seat of the audiencia of Santafé in 1549.",Geographic Context,colonial-landscapes/bogota_savanna.md,,
3,demo-bogota-1614,0.75,0.3,3,Is it a map or a painting?,"This unique “legal painting” functions as both map and landscape art. It is rare for being signed by its creator Juan de Aguilar Rendón and uses color, variable scaling, and possibly Indigenous pigments to represent the disputed territory.",Authorship and Art,colonial-landscapes/legal_painting.md,Ways of Mapping,colonial-landscapes/ways_of_mapping.md
4,demo-bogota-1614,0.6,0.7,2.2,Who were the owners of this land?,"The estate depicted on the painting belonged to Francisco de Maldonado y Mendoza. His descendants obtained titles of nobility and the estate became the center of the Marquisate of San Jorge, producing viceroys and bishops for two centuries.",The Lineage,colonial-landscapes/maldonado_lineage.md,,
5,demo-bogota-1614,0.5,0.5,1,Want to keep exploring?,"This demo covers just a small part of *Colonial Landscapes*, a larger project that explores the social and environmental transformations experienced by Indigenous populations and landscapes in present-day Colombia during the 16th and 17th centuries, developed by Santiago Muñoz, Adelaida Ávila, and María Alejandra Orduz Avella, and which inspired Telar. <br><br><a href=""https://colonial-landscapes.com"" class=""btn btn-primary"" target=""_blank"">Explore Colonial Landscapes →</a>",,,,